{
  "schema_version": "robot-description.v1",
  "robot_id": "unit",
  "source": {
    "path": "cad/body.scad",
    "sha256": "52e5ac9990a65f67cce8683a8c892b144e63233c1dccd4f3a0c7e7acd88d5077"
  },
  "package": {
    "name": "unit_description",
    "path": "ros/unit_description"
  },
  "description": {
    "format": "sdf",
    "path": "ros/unit_description/sdf/body.sdf",
    "sha256": "c2637610919cd3169c4f0222a8a31cd6642391633e5a98c264d1e24f0c3c290e"
  },
  "meshes": [],
  "mass_kg": 1,
  "center_of_mass_m": [
    0,
    0,
    0
  ],
  "inertia_check": {
    "status": "passed",
    "detail": "One 1 kg, 0.1 m uniform cube: principal moments m*(a*a+a*a)/12; cross terms zero."
  },
  "spawn": {
    "frame": "world",
    "pose": [
      0,
      0,
      0.05,
      0,
      0,
      0
    ]
  }
}
